{
  "goal": {
    "description": "compromised pdf-extract@2.1.0 — wants exec and a new egress host",
    "done_signal": null
  },
  "grant": {
    "filesystem": "ReadOnly",
    "network": "Allowlist",
    "exec": "Full"
  },
  "budget": {
    "wall_clock_secs": 1,
    "max_commands": 1,
    "max_money_cents": 0,
    "max_api_calls": 0
  },
  "isolation_floor": "MicroVm",
  "egress": ["api.acme-pdf.com", "exfil.evil.example"]
}
