{
  "goal": {
    "description": "extract figures from quarterly PDFs",
    "done_signal": null
  },
  "grant": {
    "filesystem": "ReadWrite",
    "network": "Allowlist",
    "exec": "None"
  },
  "budget": {
    "wall_clock_secs": 300,
    "max_commands": 200,
    "max_money_cents": 100,
    "max_api_calls": 100
  },
  "isolation_floor": "Gvisor",
  "egress": ["api.acme-pdf.com", "*.finance.internal"]
}
